<?xml version="1.0" encoding="utf-8"?>
<autoParts xmlns:xsi="http://www.w3.org/2001/XMLSchema-instance" xsi:noNamespaceSchemaLocation="../../XMLSchema/Schema.xsd">
    <storage>
        <parts code="P001" origin="Germany" warranty="5 years" manufacturerDate="2022-01-15">
            <name>Oil Filter</name>
            <category>Filters</category>
            <brand>Bosch</brand>
            <price>25.50</price>
            <quantity>50</quantity>
            <condition>New</condition>
            <dimensions>
                <length>10.5</length>
                <width>8.2</width>
                <height>7.0</height>
            </dimensions>
        </parts>
    </storage>
    <suppliers>
        <supplier supplierID="S001">
            <supplierName>Auto Parts Ltd</supplierName>
            <phone>+44 123 456 789</phone>
            <email>info@autoparts.com</email>
            <address>London, Industrial Road 5</address>
            <location>UK</location>
        </supplier>
    </suppliers>
</autoParts>